{ "name": "lo", "addresses": [ "127.0.0.1" ], "pscheduler_tests": [ "throughput" ], "mac": "MM:MM:MM:SS:SS:SS", "host": { "administrators": [ { "emails": [ "randomemail@randomdomain.com", "notrandomemail@notrandomdomain.com" ], "meta": { "name": "randomPerson" } } ], "client_uuid": "unique_id", "access_policy": "private", "pscheduler_service": { "tools": [ "iperf", "nuttcp" ], "tests": [ "throughput" ], "urls": [ "https://127.0.0.1/pscheduler" ] }, "archive_service": { "urls": [ "https://127.0.0.1/archiver" ], "archiver_type": "elasticsearch" }, "name": [ "randomhost" ] } }